{
  "schemaVersion": "1.0.0",
  "verifiedThrough": "2026-07-30",
  "policy": {
    "publishableRule": "status=active AND confidence=high AND blockingHoldReasons=0",
    "accessRestrictedIds": [
      "sukiyabashi-jiro"
    ],
    "accessRestrictedAuditFlags": [
      "members_or_introduction_only",
      "access_restricted"
    ],
    "nonBlockingAuditFlags": [
      "stale_neighborhood",
      "neighborhood_mismatch",
      "neighborhood_imprecise",
      "neighborhood_too_broad",
      "stale_michelin",
      "obsolete_michelin_plate",
      "obsolete_plate_taxonomy",
      "michelin_changed",
      "michelin_category_updated",
      "michelin_stale",
      "michelin_stale_unverified",
      "michelin_false",
      "michelin_current_status_unverified",
      "wrong_cuisine",
      "cuisine_too_narrow",
      "cuisine_imprecise",
      "cuisine_description_mismatch",
      "wrong_japanese_name",
      "nameJa_mismatch",
      "nameJa_incorrect",
      "nameJa_imprecise",
      "moved",
      "moved_within_neighborhood",
      "renamed",
      "stale_id"
    ],
    "publicSourceExclusions": [
      {
        "url": "https://www.nihonryori-ryugin.com/",
        "reason": "expired_certificate"
      },
      {
        "url": "https://yakitori-imai.jp/",
        "reason": "dns_failure"
      },
      {
        "url": "https://www.kanda-matsuya.jp/",
        "reason": "hostname_mismatch"
      },
      {
        "url": "https://www.nodaiwa.co.jp/",
        "reason": "https_connection_failure"
      },
      {
        "url": "https://yoroniku.jp/",
        "reason": "dns_failure"
      }
    ],
    "supersededPublicSourceExclusions": [
      {
        "url": "https://tabelog.com/tokyo/A1307/A130701/13001859/",
        "reason": "superseded_listing"
      },
      {
        "url": "https://tabelog.com/tokyo/A1302/A130202/13000488/",
        "reason": "superseded_listing"
      },
      {
        "url": "https://tabelog.com/tokyo/A1318/A131810/13164031/",
        "reason": "superseded_listing"
      },
      {
        "url": "https://tabelog.com/tokyo/A1301/A130103/13060358/",
        "reason": "superseded_listing"
      },
      {
        "url": "https://tabelog.com/tokyo/A1306/A130603/13035758/",
        "reason": "superseded_listing"
      }
    ],
    "statusVocabulary": [
      "active",
      "temporarily_closed",
      "closed",
      "ambiguous",
      "unverified",
      "duplicate",
      "non_restaurant"
    ],
    "michelinVocabulary": [
      "three_stars",
      "two_stars",
      "one_star",
      "bib_gourmand",
      "selected"
    ],
    "excludedLegacyFields": [
      "tabelog",
      "google",
      "priceRange",
      "description",
      "tags",
      "awards",
      "photoSeed",
      "image",
      "reservationUrl"
    ]
  },
  "sourceInputs": [
    {
      "path": "src/data/restaurants.js",
      "sha256": "21004ffa6c79f5e0d0dbe97882eff3d077c016fedafb7093a8f2db67380ede7f"
    },
    {
      "path": "data-audit/audit-000-081.json",
      "sha256": "3cbefad35076957e92a4d498358f8dd13c031414efba1c059e3778f0c6d9bbd3"
    },
    {
      "path": "data-audit/audit-082-162.json",
      "sha256": "3e19bdeef17bd5c96bc636985400a6edd77fd860735c9ae16addd8c76eb17874"
    }
  ],
  "counts": {
    "total": 163,
    "publishable": 91,
    "held": 72,
    "byStatus": {
      "active": 121,
      "temporarily_closed": 1,
      "closed": 12,
      "ambiguous": 7,
      "unverified": 19,
      "duplicate": 1,
      "non_restaurant": 2
    }
  },
  "records": [
    {
      "index": 0,
      "id": "sukiyabashi-jiro",
      "canonical": {
        "name": "Sukiyabashi Jiro Honten",
        "nameJa": "すきやばし次郎",
        "branch": "Ginza honten",
        "cuisine": "Sushi",
        "neighborhood": "Ginza"
      },
      "status": "active",
      "publishable": false,
      "holdReasons": [
        "access_restricted",
        "audit_flag:stale_michelin"
      ],
      "michelin": {
        "distinction": null,
        "edition": null,
        "verified": false,
        "sourceUrl": null
      },
      "lastVerified": "2026-07-30",
      "confidence": "high",
      "sources": [
        {
          "type": "official",
          "url": "https://www.sushi-jiro.jp/"
        },
        {
          "type": "michelin",
          "url": "https://guide.michelin.com/en/jp/tokyo-region/tokyo/restaurants/3-stars-michelin"
        },
        {
          "type": "tabelog",
          "url": "https://tabelog.com/tokyo/A1301/A130101/13002260/"
        },
        {
          "type": "other",
          "url": "https://apnews.com/article/32dd0d4232d9818e38f8b8a984bab636"
        }
      ]
    },
    {
      "index": 1,
      "id": "sushi-saito",
      "canonical": {
        "name": "Sushi Saito",
        "nameJa": "鮨さいとう",
        "branch": "Ark Hills South Tower",
        "cuisine": "Sushi",
        "neighborhood": "Roppongi 1-chome"
      },
      "status": "active",
      "publishable": false,
      "holdReasons": [
        "access_restricted",
        "audit_flag:members_or_introduction_only",
        "audit_flag:stale_michelin"
      ],
      "michelin": {
        "distinction": null,
        "edition": null,
        "verified": false,
        "sourceUrl": null
      },
      "lastVerified": "2026-07-30",
      "confidence": "high",
      "sources": [
        {
          "type": "michelin",
          "url": "https://guide.michelin.com/en/jp/tokyo-region/tokyo/restaurants/3-stars-michelin"
        },
        {
          "type": "tabelog",
          "url": "https://tabelog.com/tokyo/A1308/A130802/13015251/"
        }
      ]
    },
    {
      "index": 2,
      "id": "sushi-yoshitake",
      "canonical": {
        "name": "Sushi Yoshitake",
        "nameJa": "鮨よしたけ",
        "branch": "Ginza",
        "cuisine": "Sushi",
        "neighborhood": "Ginza"
      },
      "status": "active",
      "publishable": true,
      "holdReasons": [
        "audit_flag:stale_michelin"
      ],
      "michelin": {
        "distinction": null,
        "edition": null,
        "verified": false,
        "sourceUrl": null
      },
      "lastVerified": "2026-07-30",
      "confidence": "high",
      "sources": [
        {
          "type": "official",
          "url": "https://www.sushi-yoshitake.com/"
        },
        {
          "type": "michelin",
          "url": "https://guide.michelin.com/en/jp/tokyo-region/tokyo/restaurants/3-stars-michelin"
        },
        {
          "type": "tabelog",
          "url": "https://tabelog.com/tokyo/A1301/A130101/13024076/"
        }
      ]
    },
    {
      "index": 3,
      "id": "sushi-sawada",
      "canonical": {
        "name": "Sawada",
        "nameJa": "鮨さわ田",
        "branch": "Ginza",
        "cuisine": "Sushi",
        "neighborhood": "Ginza"
      },
      "status": "active",
      "publishable": false,
      "holdReasons": [
        "audit_flag:stale_michelin",
        "confidence_not_high"
      ],
      "michelin": {
        "distinction": null,
        "edition": null,
        "verified": false,
        "sourceUrl": null
      },
      "lastVerified": "2026-07-30",
      "confidence": "moderate",
      "sources": [
        {
          "type": "tabelog",
          "url": "https://tabelog.com/tokyo/A1301/A130101/13001043/"
        }
      ]
    },
    {
      "index": 4,
      "id": "sushi-arai",
      "canonical": {
        "name": "Sushi Arai",
        "nameJa": "鮨あらい",
        "branch": "Ginza",
        "cuisine": "Sushi",
        "neighborhood": "Ginza"
      },
      "status": "active",
      "publishable": false,
      "holdReasons": [
        "audit_flag:stale_michelin",
        "confidence_not_high"
      ],
      "michelin": {
        "distinction": null,
        "edition": null,
        "verified": false,
        "sourceUrl": null
      },
      "lastVerified": "2026-07-30",
      "confidence": "moderate",
      "sources": [
        {
          "type": "tabelog",
          "url": "https://tabelog.com/tokyo/A1301/A130101/13188186/"
        }
      ]
    },
    {
      "index": 5,
      "id": "harutaka",
      "canonical": {
        "name": "GINZA HARUTAKA",
        "nameJa": "銀座 はるたか",
        "branch": "Ginza",
        "cuisine": "Sushi",
        "neighborhood": "Ginza"
      },
      "status": "active",
      "publishable": true,
      "holdReasons": [
        "audit_flag:michelin_changed"
      ],
      "michelin": {
        "distinction": "three_stars",
        "edition": 2026,
        "verified": true,
        "sourceUrl": "https://guide.michelin.com/en/tokyo-region/tokyo/restaurant/harutaka"
      },
      "lastVerified": "2026-07-30",
      "confidence": "high",
      "sources": [
        {
          "type": "michelin",
          "url": "https://guide.michelin.com/en/tokyo-region/tokyo/restaurant/harutaka"
        },
        {
          "type": "tabelog",
          "url": "https://tabelog.com/tokyo/A1301/A130103/13032283/"
        }
      ]
    },
    {
      "index": 6,
      "id": "daiwa-sushi",
      "canonical": {
        "name": "Daiwa Sushi",
        "nameJa": "大和寿司",
        "branch": "Toyosu Market",
        "cuisine": "Sushi",
        "neighborhood": "Toyosu"
      },
      "status": "active",
      "publishable": true,
      "holdReasons": [
        "audit_flag:stale_neighborhood"
      ],
      "michelin": {
        "distinction": null,
        "edition": null,
        "verified": false,
        "sourceUrl": null
      },
      "lastVerified": "2026-07-30",
      "confidence": "high",
      "sources": [
        {
          "type": "tabelog",
          "url": "https://tabelog.com/tokyo/A1313/A131307/13227265/"
        }
      ]
    },
    {
      "index": 7,
      "id": "sushi-dai",
      "canonical": {
        "name": "Sushi Dai",
        "nameJa": "寿司大",
        "branch": "Toyosu Market",
        "cuisine": "Sushi",
        "neighborhood": "Toyosu"
      },
      "status": "active",
      "publishable": true,
      "holdReasons": [